review_text,rating,date,review_length
৯৬ টাকায় ভালো পণ্য পেয়েছি। আপনারা চাইলে নিতে পারেন। এই সেলার ভাই থেকে। ধধন্যবাদ সেলার ভাই আপনাকে ভালো পণ্য দেওয়া এবং সুন্দর ব্যবহারের জন্য। ,5,27 Sep 2023,140
"অনেক দিন ব্যবহারের পর রিভিউ দিলাম।প্রডাক্ট মোটা মুটি ভালোই ছিল। ধন্যবাদ দারাজ সেলার কে।


",5,22 Oct 2023,90
Your product is really good in reasonable Price..  i'm really satisfied...  highly recommended 💚,5,19 Oct 2023,96
"price Onujai tik ace,, tr por salar r ektu carefully howa dorkar, bises kore product Checking khetre🥰",4,22 Sep 2023,101
"দাম হিসেবে ঠিক আছে,, তবে ২ সাইজ বলছিলাম কিন্তু সব এক সাইজ এর দিয়েছে এই বিষয়ে দারাজ এর গুরুত্ব দেয়া উচিত কারণ একটা কিছু কেনার পর মন মতো না হলে পরে আর কেনার আগ্রহ থাকে না🙂🙂",3,20 May 2024,170
অসাধারণ প্রোডাক্টটি লাগলে নিতে পারেন আপনারা ,5,09 Feb 2024,44
ভালো ছিল বউ অনেক খুশি হইছে,5,31 Mar 2024,26
প্রোডাক্টটা সত্যিই অনেক সুন্দর।অনেক ভালো প্রোডাক্ট পেয়েছি।  সেলার ভাইকে ধন্যবাদ খুব ভালো ব্যবহার করেছে এবং প্রোডাক্টটা ভালো দিয়েছে। ,5,17 Sep 2023,133
"এতো অল্প দামে প্রোডাক্ট পাওয়া দারাজ ছাড়া সম্ভব না।
ধন্যবাদ সেলার এবং দারাজ কে, সুন্দরভাবে প্যাকেজিং করে করে দেওয়ার জন্য🥰",5,16 Sep 2023,120
Alhamdulillah ei niye 4bar neoya hoyeche products onk valo Shukriyaa zajakallahu khairan 🖤🌸,5,03 Oct 2023,91
"ata khubi valo chilw 
best quality price onujai thik thak silw",5,12 Dec 2023,62
একদম ভুয়া পোডাক্ট দিলেন চাইলাম যা তার কিছু দিলেন না একদম নরমাল আবার বডিতে হয় না বাচ্চা দের টা দিলেন দরার আগে পেটে যায় একটাও হয় না সব বাচ্চাদের সাইজের  এত টা দূরনিতি করলে কি কেনা কাটা করা যায়।,5,19 Aug 2023,191
"প্রডাক্টটির মান দাম হিসাবে অনেক ভালো ছিল এবং যথাসময়ে ডেলিভারী পেয়েছি, এজন্য সেলার এবং দারাজ উভয়কেই ধন্যবাদ
",5,11 Sep 2023,107
আমার ভাবিকে পড়িয়ে দেখেছি ভালোই নিতে পারেন ,5,31 Jan 2024,42
চাইলাম এক কালার দিলেন আরেক কালার আর সাইজ ১ টার ঠিক আছে কিন্ত বাকি ২ টা ইক্টূ ছোট । জাই হোক দাম অনুজাই কাপর ঠিক আছে কিন্তু সাইজ বড় ছোট।  পুর পুরি সন্তস্ট হতে পারলাম না। ,5,11 Jun 2023,168
"আলহামদুলিল্লাহ প্রোডাক্টটি পেয়েছে
কিন্তু সেলার এত কম টাকায় এত ভালো প্রোডাক্ট দেয় কিভাবে । প্রোডাক্টগুলোন এর ছবি তোলা হয়নি তাই দিতে পারলাম না ছবিগুলো ।",5,18 Aug 2023,154
আমি দারাজের নিয়মিত ক্রেতা এখন পর্যন্ত কোন খারাপ কিছু দেন সি। সত্যি বলতে ব্রা গুলো অসাধারণ ❤️দাম অনুযায়ী অনেক ভালো কমফোর্টেবল 🖤 ,5,07 Jun 2023,127
যেমনটা চয়েছিলাম তেমনটা পাইছি খুবই ভালো একটা প্রোডাক্ট কথা কাজে মিলে গেছে  সেলার ভাই এর বেবহার খুবি ভালো লাগছে ধন্যবাদ দারাজ কে,5,11 Sep 2023,126
"Nijer kace akhn nijer lojja lagce, je akbar product valo peye abr o order diyecilam.. Unexpected.. next a ar daraz theke kono product valor vul chinta ta ar korbona.. thanks..bissash er maan ato valo kore rakhar jonno.. ",5,04 Sep 2023,220
"ব্রা গুলো অনেক ভালো ছিল,,আমার ফ্রেন্ডের জন্য নিয়ে ছিলাম সে অনেক পছন্দ করছে,,, যার জন্য নিছি সে বাসায় নিয়ে গেছে তাই পিক দিতে পারি নাই,,,এত ভালো পন্য দেওয়ার জন্য দারাজকে ধন্যবাদ ",5,26 Jul 2023,176
"দাম তুলনায় অনেক ভালো কাপরের মান ও ভালো 
সবমিলিয়ে  ভালো লেগেছে
আপনারা চাইলে নিতে পারেন ঠকবেন না আশা করি😇😍",5,11 Aug 2023,104
কোয়ালিটি গুড।কিন্তু সেলার সাইজে গরমিল করেছে। আমার চাহিদা অনুযায়ী ২ টির সাইজ ঠিক ছিলো বাট একটা ছোট দিয়েছে।,5,18 Jul 2023,105
প্রোডাক্টের কোয়ালিটি বেশ ভালো। এতো অল্প টাকা ভালো প্রোডাক্ট পেয়ে সন্তুষ্ট আমি। আপনারা চাইলে নিতে পারেন। 😊,5,08 Aug 2023,105
আলহামদুলিল্লাহ সব ঠিক আছে যেমনটি চেয়েছিলাম ঠিক তেমনটিই পেয়েছি আমার কম্পিউটারে খুব সুন্দর ভাবে কাজ করতেছে। আপনারা চাইলে নিশ্চিন্তে নিতে পারেন। সময় স্বল্পতার কারণে ছবি দিতে পারলাম না বলে আন্তরিকভাবে দুঃখিত।,5,11 Sep 2023,207
ami 2 set nisilam..size thik moto dei ni.. +ekta chira chilo..r eigulo ekbar use korlei shelai khule jaitese,5,14 Aug 2023,108
"তিনটার মধ্যে একটা ভালো দিছে, আরগুলা একদম বাজে, তবে এইদাম এ ঠিক আছে,  এর একটু বেশি দাম দিয়া ভালো প্রডাক্ট নেওয়া ভালো আমার মনে হয়",5,20 Aug 2023,127
very good products in low price...2 bras are ok...but 1 bra is tight...i think it’s  small size...you should be care full and need to cross check before sending ,4,28 Aug 2023,161
"onk  valo celo products gulo.....sob gulo e perfect celo...... donnobad daraz k eto valo products deyar jonno....
onk valo ....apnara Kno sondeho care e nita paren☺️",5,04 Aug 2023,165
দাম অনুযায়ী অনেক ভালো আমি খুবি খুশি হয়েছি।আজকেই প্রডাক্ট হাতে পেয়ে আবারও ৬ পিছ অর্ডার করেছি।আসা করি এবার ও ভালোটাই পাবো।ধন্যবাদ দারাজ কে।,5,19 Jun 2023,137
"i clearly mentioned the seller in chat to check the products before sending.still they sent me defected products. so disheartened with it. the stitch is not done in many sites of the products. 
anyways its so okay quality ",5,20 Jun 2023,222
,5,13 Jun 2023,0
"সেলারের মানসিকতা ভালো নয়, পণ্যের মান দাম হিসেবে মোটামুটি। মোটেও হেল্পফুল নয় সেলার।বিকল্প থাকায় এমন সেলার এড়িয়ে চলবেন সবাই",5,10 Aug 2023,121
"আমাকে পন্য না দিয়ে ডেলিভার্ড দেখানো হচ্ছে। এটা কেমন কথা 
আমার সাথে সেলার বা কোন ডেলিভারি ম্যান আমার সাথে কথাও বলেনি",5,30 Jul 2023,115
প্রোডাক্ট গুলো ভালো পাইছি তা ভালো লাগলে নিলাম আপনারা চাইলে নিতে পারেন আপনারা চাইলে নিতে পারেন তবে আমার কাছে প্রোডাক্ট গুলো অনেক ভালো লাগছে,5,24 Jul 2023,138
"দাম অনুযায়ী ভালো, কিন্তু ৩ টা প্রায় কালার একরকম হয়ে গেছে, একটা আবার ফাটা ছিলো, কিন্তু প্রডাক্ট গুলো ভালো, ",5,12 Jun 2023,106
পণ্য অনেক ভালো আর আরাম দায়ক আপনারা নিতে পারেন আশা করি গরমের ভিতর এই পণ্য পরে থাকলে কোনো সমস্যা  হবেনা আর বিরক্ত মনে হবেনা আর এই কম দামে এতো সুন্দর  জিনিস আশা করিনি ধন্যবাদ  আর এই দিয়ে অনেক পণ্য নিছি কোনো বার ঠকিনি আমি ,5,18 Jun 2023,218
,5,03 Mar 2023,0
ak kothai oshadharon...bebohar korar por bolchi...ato kom takai amon jinis pabo asha korini...sotti bolte baby howar por ami khub jamelai porechilam bra nia karon mota hoye giachi onek...aita order korar age r o 4ta dami dami kinechi kintu ashole oivabe comfortable hoina..ai guli amar moto vari apu der jonno sotti kajer....ato kichu share korar karon holo amio review dekhe order kori..amar valo lagbe jodi amar review a karo upokar hoi.,5,11 Aug 2023,439
ami 2 bar nici.onek valo apnara nite paren,5,18 Jan 2024,42
"dam onujai onk valo
",4,06 Mar 2024,20
খুব ভালো নিতে পারেন সবাই ,5,10 Mar 2024,25
অনেক ভালো সবাই নিতে পারেন,5,05 Mar 2024,25
"product was good according to the price, in this price it was a great deal.. ",5,02 Nov 2023,77
khub valo ,4,28 Mar 2024,10
rabar typer🥰,5,31 Mar 2024,12
পেকেজিং টা অন্য সবার থেকে অনেক ভালো লাগছে।ডেলিবারি টা বেশি লেট হইছে।বাট সন্তুষ্ট আমি,5,07 Oct 2023,84
ভালোই। দাম অনুযায়ী ভালোই আছে,4,29 Feb 2024,28
"যদিও সেলারের এক্টিভিটি খুবই কম, প্রোডাক্ট হাতে পাইতেও সময় লাগছে বেশি।পণ্যের দাম অনুযায়ী ভালো। ",5,19 May 2023,96
দাম অনুযায়ী পণ্যটি অনেক ভালো আপনারা চাইলে নিতে পারেন ধন্যবাদ সেলার ভাইকে ধন্যবাদ দারাজ কে,5,13 Apr 2023,90
😍😍😍1st time nilam Market Price thake Kom dam porce that's Daraz 🥰🥰🥰sate gift stickers ,5,16 Apr 2023,86
kapor gulo khub soft c colure gulo o sundor hoise mashalla amar khub valo lagse thanks daraj,5,15 May 2023,92
Dam onujayi vlo product kapor ta o soft ase.. amr vabi niyese... Apnara chaile nite paren..,5,24 Aug 2023,91
"যেমনটা চেয়েছিলাম তেমনই পেয়েছি , কাপড়ের মানও ভালো । কাপড়টা অনেক সফট আর আরামদায়ক, পড়ে আরাম পেয়েছি। ",5,27 Jul 2023,97
product khub bhalo tobe Delivery time beshi lagche. ,4,12 Dec 2023,52
moto MOTi Valoi aca,5,19 Mar 2024,19
osadaron,5,15 Mar 2024,8
"১টা একটু ছেড়া ছিল। বাকি ২টা ভালো ছিল। ওভার অল ভালোই, খারাপ না।",4,12 Nov 2023,62
৬ পিস নিলাম তার মাঝে 😡একই কালারের চারটা😡 খুশি হইতে পারলাম না😔,1,11 Nov 2023,61
খুব ভালো পছন্দ হয়েছে ,4,18 Feb 2024,21
alhamdurillah onek onek valo sobai nite paren ...thank you daraz and seller vaikey ❤️❤️,5,15 Sep 2023,87
"onk valo jinis

",4,06 Mar 2024,16
khub vlo celo products ,4,10 Feb 2024,23
"onk valo apnaraw nite paren r delivery man ar babohar onk valo thanks
",5,07 Oct 2023,70
thanks daraz🤗jamon cheyechi thik tamon peyechi. r delivery vaiya ta o onk vlo chilo😊,5,12 Aug 2023,84
"কোয়ালিটি ভালো, কালার ও রেনডম দিয়েছে। আমার পছন্দমতো হয়েছে। নিতে পারেন যাদের প্রয়োজন। ",5,11 Apr 2023,84
খুবই ভালো হইছে ৯৯ টাকা দিয়ে এর থেকে ভালো আমি আর আশা করি না আমি ছয়টা অর্ডার করছি,5,27 Jun 2023,81
প্রোডাক্ট অনেক ভালো ছিল😍😍 খুব তারাতারি পেয়েছি আপনারা চাইল নিতে পারেন সেলার ও ভালো ছিল👌,5,20 Apr 2023,86
"products valo kintu 2ta aktu chera chilo🙂,,tao pb na onk valo jinis sobai nite pareen",5,28 Jul 2023,85
"Valo chilo..
but jei Color gulo dite bolse ...oi gulo deyne....
khub khrp lagse",5,15 May 2023,79
khub e valo hatey paowar por bissas korte parcina eto kom dam e eto valo product,5,09 Sep 2023,80
"যে কাপড় মনে করেছিলাম সেই কাপড় না, তবে খারাপ না, আরামদায়ক, quality ভালো Alhamdulillah ",5,05 May 2023,86
"আলহামদুলিল্লাহ, প্রোডাক্ট হাতে পেলাম ।।99 টাকায় খুব ভালো প্রডাক্ট। আপনারা নিতে পারেন৷ ",5,22 Jul 2023,86
Good Products ,4,04 Mar 2024,14
it was good in low range.. I'm satisfied..be trusted ,4,15 Nov 2023,53
গুণগত মান ভালো ছিল সঠিক সময় ডেলিভারি পেয়েছি ধন্যবাদ ,5,15 Nov 2023,54
প্রাইস অনুযায়ী প্রোডাক্টের মান ভালো।  সেলারকে ধন্যবাদ ,5,18 Nov 2023,54
"অর্ডার দিছি একরকম দিছে অন্যরকম দুই নাম্বারি

 ধান্দা যতসব",1,15 Nov 2023,57
সাইজ ৩৮ হলে আরো ভালো হতো মাফ না দিয়ে নিয়েছি তো তাই এমন হয়েছে,5,17 Oct 2023,63
Good Quality ,5,22 Feb 2024,13
onak daurn,5,18 Mar 2023,10
"onek valo product...

icce korle sobai nite paren... ",5,12 Nov 2023,53
"আলহামদুলিল্লাহ ভালো লাগলো ধন্যবাদ আপনাকে,
কাপড় গুলো বেশ সুন্দর ",5,15 Oct 2023,64
দুইটা মোটামুটি আর একটা একদমই খারাপ হয়েছে যেমনটা আশা করছিলাম তেমন পেলাম না😭,5,12 Sep 2023,74
quality valo just bre strep gulo halka ektu boro hole ghar e tan portona,5,16 Sep 2023,72
one of the best product.. thankyou daraz. best quality ❤️,5,31 Oct 2023,57
gd product but size gula ektu chuto boro Hoygese🙂,5,31 Oct 2023,49
আলহামদুলিল্লাহ অনেক ভাল আপ্নেরা চাইলে নিতে পারেন  এক কথায় অসাধারণ ,5,08 Oct 2023,67
দাম অনুযায়ী জিনিস অনেক ভালো।। নিতে পারেন,5,26 Nov 2023,40
"very bad
poor কোয়ালিটি😡
সাইজ ঠিক নেই😡
",1,21 Nov 2023,39
Alhamdulillah ❤️... product ta vloi cilo... jemon ta chaisi temotai paisihh,5,08 Aug 2023,75
"very good quality , এত কম টাকায় ভালো পণ্য, আশা করি নাই,সবাই নিতে পারেন।",5,17 Jun 2023,72
"ধন্যবাদ  প্রিয় বিক্রেতা বন্ধুদের কে,টাকা পরিমাণে প্রোডাক্ট  ভাল পেয়েচি।",5,12 Jun 2023,71
onek valo cilo prodakt ta apnara nite paren kinto delivery cars ta onek besi,5,16 Apr 2023,76
সত্যি বিশ্বাস করার মত না এত ভাল কাপর দিবে আপনার চাইলে কিনতে পারেন 🥰🥰🥰,5,25 Aug 2023,69
Ami vabcilam agola kaporer..kinto agola soft silker...dam onujayi vlo e ,5,28 Apr 2023,72
khub valo acilo product ei price e emon  valo product asa kora jay na ,5,14 Apr 2023,70
ponno hate peyeci khubei valo akta produc ami nici apnara o nite paren ,5,21 Jun 2023,71
দাম অনুযায়ী মাল ভালো চাইলে নিতে পারেন সবাই,5,25 Nov 2023,42
"অসাধারণ, আপনারা ও নিতে পারেন। কাপড় ও খুবই ভালো। দাম হিসেবে খুবই ভালো। ",5,03 Aug 2023,70
Pic Uthai Nai Dam Hisabe Onek Valo Daraz Theke ai ekta product Pailam valo,5,16 May 2023,74
valo chilo product.. ,5,11 Jan 2024,21
বেশ ভালো।অনেক কম্ফোর্টেবল 😊,4,13 Jan 2024,27
"রেগুলার ইউসের জন্য বেশ কমফোর্টেবল।
",4,14 Dec 2023,35
৯টা নিয়েছি।সব গুলো ভালো সাইজো ঠিক আছে ❤️,5,17 Nov 2023,41
সবাই নিতে পারেন ভালো মান ও দাম ও কম ছিলো,5,17 Nov 2023,40
good product ,5,01 Feb 2024,13
,5,16 Aug 2023,0
,5,05 Aug 2023,0
Price onujayi thik ache 👍,5,07 Jan 2024,25
order dilam 36 r 34 dilen😒,1,03 Jan 2024,26
products ta kub valo. soft onk. ,4,11 Dec 2023,32
"অনেক ভাল ছিল,, আপনারা নিঃসন্দেহে নিতে পারেন",5,09 Nov 2023,43
ভালো ,4,29 Jan 2024,5
পন্যের বিবরণের মিল পেয়েছি। সাইজও ঠিক ছিল। ,5,10 Nov 2023,42
দাম অনুযায়ী ঠিক ঠাক আছে,5,31 Dec 2023,23
ভালো ই ছিল সেম জিনিস ই ধন্যবাদ সেলার কে,5,01 Dec 2023,39
price hisebe onek valo. huge elasticity fabric.,5,05 Nov 2023,47
vlo chilo,5,16 Jan 2024,9
alhamdulillah ei niye 5bar neoya hoyeche good products🖤,5,05 Oct 2023,55
2 pish odar korsilam kinthay 6 pish disay valo silo ,5,04 Oct 2023,52
as per price its good,5,24 Dec 2023,21
"কোয়ালিটি ভালোই ছিল শুধু 
 চক্ষুলজ্জার কারনে ছবি ছাড়াই রিভিউ দিলাম ",4,19 Apr 2023,68
kicho din use korar por review dilam. Alhamdulillah product valo,5,17 Apr 2023,64
"দেখতেতো মোটামুটি ভালো দেখা যায়, ব্যাবহারের পরে বাকিটা বুজব, ",5,03 Sep 2023,60
"ভালো ছিলো,,,নিতে পারেন সবাই,,,ডেলিভারি ম্যান ও খুব ভালো ছিলো",5,12 Apr 2023,60
"আলহামদুলিল্লাহ যেমন চেয়েছি তেমন পেয়েছি,,
ধন্যবাদ দারাজকে,,,",5,17 Apr 2023,59
"product quality motamoti valoi , bt seller behavior valo na 💔",4,31 Jul 2023,61
faltu jinis body size ar satha bra kno mil naitakatai mati amar hoica,5,10 Apr 2023,69
ei damer moddhe eita good products.  chaile obossoi nite paren,5,10 Jul 2023,62
খুব খারাপ পণ্য সেলাই খুলে যায়।,5,27 Nov 2023,30
akdom faltu cira huk thik nai aktar o,2,22 Nov 2023,37
good products ❤️❤️,5,12 Jan 2024,18
Valo 🥰🥰🥰,5,10 Jan 2024,8
Valo ponno ,5,14 Jan 2024,11
akjn k gipt krci so picture na tbe product 10 e 10 dilm.,5,28 Sep 2023,56
"বাজে প্রোডাক্ট কেউ নিবেন না 
",5,16 Nov 2023,29
quality was good..as a price product is very good,5,18 Oct 2023,49
সামনের দিনগুলোতে এই মালের পণ্য এভাবেই যেন থাকে,5,22 Oct 2023,46
"wow 
",5,08 Jan 2024,5
temon vlo na ekrokom chole,4,10 Dec 2023,26
"Good product... recommended.
",5,12 Nov 2023,29
alhamdullah product valo porca,4,13 Nov 2023,30
Best product...Khub valo product dice..seller k dhonnobad,5,18 Sep 2023,57
sobai nite paren kom dame er chaite r valo ki hote pare ,5,16 Sep 2023,56
ভালো ,5,26 Dec 2023,5
Nice,5,31 Dec 2023,4
দাম হিসেবে ভালোই।,5,31 Dec 2023,17
vlo na khub kharap ,5,31 Dec 2023,19
satisfied. highly recommended. ,5,04 Nov 2023,31
ভালো কিন্তুু পন্যের রং অনেক বাজে,4,02 Nov 2023,32
"good product 
# Value for money ",4,31 Oct 2023,32
"Alhamdulillah product vlo cilo

",4,02 Nov 2023,32
"যে কালার চেয়েছিলাম তা দেয় নাই, এক পিস সেলাই ছিড়া ছিলো।",5,27 Jun 2023,57
৩ টা নিয়েছিলাম। ২ টা ব্রার হুক নাই।সেলাই খবই দুর্বল। ,5,12 Apr 2023,53
দাম তুলনায় প্রোডাক্ট ভালো ছিল। কাপড়ের  মান টা ও ঠিক আছে। ,5,20 Jun 2023,57
এত কম দামে ভালো পণ্য পাব বিশ্বাস করিনি ধন্যবাদ ছেলের ভাই ,5,12 Jun 2023,57
The item is better than the prices. you can order it,5,15 Aug 2023,52
"eto kom dameo khob vhalo product.thank you daraz

",4,20 Aug 2023,50
"প্রডাক্ট ভালো ছিলো, কিন্তু ডেলিভারি আরো দ্রুত দিতে হবে।",5,23 May 2023,55
"অল্প টাকায় এত ভালো প্রোডাক্ট আশা করিনি,ধন্যবাদ দারাজকে ",5,07 Aug 2023,56
ভালোই খারাপ না চাইলে সবাই নিতে পারেন রিভিউ দিতে দেরি হলো। ,5,14 Jun 2023,58
"price onujayi product is good👍 ami satisfied 🖤
",4,20 Aug 2023,47
ভালোই দাম অনুযায়ী তবে যে কালার দেখাইছে তার একটাও মিল নাই,5,13 May 2023,57
product ti valoi ace soft and comfortable thanks daraz,5,14 Aug 2023,54
"না৷ এখন ও ব্যবহার করি নাই।৩টা ব্রা,মাজে ১টা এই ব্রা,ছিরা,",1,17 May 2023,57
kapor onk soft kom takai onk valo. seller o valo. ,5,20 Apr 2023,50
আলহামদুলিল্লাহ ভালো .... কিন্তু কাপড়টা একটু পাতলা ছিল। ,5,23 Aug 2023,55
good ,5,22 Dec 2023,5
অসাধারণ প্রোডাক্ট ,5,22 Dec 2023,18
nice ,5,19 Dec 2023,5
ভালো আপনারা নিতে পারেন ,5,23 Nov 2023,23
আলহামদুলিল্লাহ ভালোই 😊,5,22 Nov 2023,22
not good nor bad. it's average ,5,29 Oct 2023,31
কাপড়ের কোয়ালিটি আরেকটু ভালো হলে ভালো হতো ,5,29 Sep 2023,43
Valo ,3,12 Nov 2025,5
quality onk valo.soft,5,16 Nov 2023,21
dam shihabe thik ace,4,18 Nov 2023,20
প্রাইজ হিসেবে ঠিকঠাক ছিলো 🙂🙂,5,18 Oct 2023,28
দাম বিবেচনায় ঠিক আছে👍,4,16 Nov 2023,22
আপনাদের পণ্য টি হাতে পেয়েছি অনেক ভালো লাগলো ,5,22 Sep 2023,45
"কম দামের মধ্যে মোটামুটি ভালো প্রোডাক্ট,,👍👍",4,24 Sep 2023,42
- Alhamdulillah jemon caichi temoni paichi ,5,22 Sep 2023,43
Not bad at all at this price ,4,13 Nov 2023,29
