review_text,rating,date,review_length
ভাই আমি প্রোডাক্টটা অর্ডার করছিলাম তার তিন চার দিনের ভিতর পেয়ে গেছি সেলারের ব্যবহার অনেক ভালো ছিল ধন্যবাদ ছেলার ভাইকে কিন্তু! প্রোডাক্ট যেমন দেখছিলাম তেমন পাই নাই কোয়ালিটি একেবারে খারাপ না এভারেজ টাইপের আপনারা কিনলে কিনতে পারেন প্যাকেজিংটা মোটামুটি ভাল ছিল আর আপনারা যারা আমার রিভিউ টা দেখছেন একটা লাইক দিয়ে দিবেন যেন আমি বুঝতে পারি কয়জন আমার রিভিউ টা দেখল..!! ধন্যবাদ Daraz কে তবে মনের মত হলো না...!! 😊❤️‍🩹 ,5,08 Jul 2025,411
",,আলহামদুলিল্লাহ দাম হিসাবে পণ্য টা ভালো পাইছি,,, ",5,14 Mar 2025,50
খুব বাজে জুতা ভালো না আমি যেমন টা দেখি তেমন টা দেয়নি কিন্তু  আমার মনট খারাপ এই সব জুতা কেও নিবেন না..🥴🥴🥴🥴😭🥰 ,5,21 Dec 2024,108
"whatever, according to the price it is good product, I think , because it is very low price and for this low it is best product ",5,19 Aug 2025,128
Dam onujayi juta ta khub Valo. Eta amar first order from daraz ar prothom orderei valo legeche 👌👌 ,5,14 Aug 2025,98
যেরকম অর্ডার দিছি সেরকম আসে নাই। দেখেশুনে ভেবে নিবেন আর প্রোডাক্টটা এরকম ভালো মনে হচ্ছে না। তবে দাম অনুযায়ী ঠিক আছে।  ,5,15 Dec 2025,119
আলহামদুলিল্লাহ টাকা হিসাবে জুতা অনেক ভালো আমি ভাবতেও পারিনি এতো সুন্দর হবে আপনারাও নিতে পারেন কনো সমস্যা নাই  ,5,14 Mar 2025,110
"দামের বিবেচনায় যথেষ্ট ভালো প্রোডাক্ট, মোটামুটি ময়লা না করলে কিছুদিন হ্যান্ডসাম লুকিংয়ের সাথে আরামদায়ক সঙ্গী হবে, ডান পায়ের জুতার ফিতা ঠিক দিলেও বাম পায়ের ফিতা ছোট, ভালো ভাবে বাধা যায়না ' এইসব ছোট বিষয়ে সেলারের নজর দেওয়া প্রয়োজন, মিস্টেক গুলো কাস্টমারের অস্বস্তি বাড়িয়ে দেয়' ওভারল ভালোই 👍 ",5,19 Nov 2024,288
জুতা মোটামুটি ভালই কিন্তু আমি দেখেছিলাম ব্ল্যাক আর দিয়ে দিয়েছে হালকা হলুদ আর বাদামি কালার মোটামুটি ভালো আছে আপনারা নিতে পারেন চাইলে ভালোই কিন্তু আমি দেখেছিলাম ব্ল্যাক আর বিয়ে দিয়েছে হালকা হলুদ আর বাদামি কালার মোটামুটি ভালই আছে আপনারা নিতে পারেন চাইলে  ,5,03 Jun 2025,256
"কম দামের হিসাবে ভালো,  কিন্তু  রাফ ইউজ করা যাবে না, কপি মাল আর কত ভালো হলে😂 তবে আপনারা চাইলে নিতে পারেন,  ফুটপাত থেকে কিনলেও ৪০০ নিচে কিনতে পারবেন না ",5,15 Jan 2026,150
যে কোয়ালিটি জুতাগুলা দেখেছিলাম সেই কোয়ালিটি তো হইল না এগুলোর তো কালার আলাদা আপনাদের প্রোডাক্ট একটু দুর্বলে দেখতেছি ,5,13 Nov 2025,117
এত বড় দোকা দিবে দারাজ আমি কল্পনা করি নাই অর্ডার করেছি সাদা জুতো আমাকে দিয়েছে কাল জুতো এবং অনেক বাজে মডেল এই মডেলের যতই আমি অর্ডার করি নাই এই ধরনের ধোকা দিলে কিভাবে আমরা নেক্সট অর্ডার করবো ,5,03 Oct 2025,190
"ভেতরের আস্তরণে দুই ধরনের কাপড় দেওয়া। এক পায়ে সবুজ  কাপড় আরেক পায়ে কালো কাপড় যেটা  খুবই 
জঘন্য দেখাচ্ছে।ভিতরের সাদা আস্তরণটা ১০ টাকা দামের টাওয়েল দিয়ে সেলাই করা এবং খুবই ময়লা ফেলে দেয়ার জিনিস ডেলিভারি দিয়েছে। এটা দারাজের জন্য খুবই খারাপ সংবাদ। দারাজে যারা কেনাকাটা করে তাদেরকে এই সমস্ত মান দিলে কোনদিন দারাজে কেনাকাটা করবে না। দারাজ এর উচিত এই সমস্ত প্রতিষ্ঠান ব্যান করে দেয়া  ",5,03 Oct 2025,388
"প্রোডাক্ট অনেক লো কোয়ালিটি। ডেলিভারি চার্জসহ আমার মোট খরচ হয়েছে ৪০০ টাকা। আর কিছু টাকার যোগ করলে ভালো মানের একটা জুতা পাওয়া যেত সে অনুযায়ী এ দুইটা একেবারে লো কোয়ালিটি। আর এই জুটাতে একটা পিন বের করা ছিল যেটাতে  আমার হাত কেটে গিয়েছে।। আপনার একটা ছবিতে যেমন দেখানো হয়েছে এটি একেবারে ভিন্ন। আরেকটি জুতো দেখতে একেবারে পুরাতন মনে হয় পুরাতন মাল আমাকে ধরিয়ে দিয়েছে।।আমি সাজেস্ট আরেকটু বাজেট বাড়িয়ে ভালো মানে জুতা নিতে ।।
বাকি সবকিছু ঠিকঠাক ছিল ডেলিভারি অনেক তাড়াতাড়ি পেয়েছি। ",5,20 May 2025,482
Dam onujai thik ache oto j valo seta na.. But ja ache enough.. Pichone logo ta ulta chilo r jota ta ektu shokto.. R baki sob thik ache  ,5,14 Aug 2025,136
" দেখায় একটা আর দিছে আরেকটা,  সেলারদের চোখে সমস্যা আছে,  লোক ঠকানো ব্যাবসা করে, দারাজ থেকে আস্থা উঠে গেছে😡😡😡😡 ",5,15 Sep 2025,109
picture dekhe oder desilam but oita na dea onnu color dise . tarpor o valo tai paichi shoes ta onk vlo💥 ,5,06 Feb 2025,104
"আজ হাতে পেলাম কিন্তু প্রোডাক্ট এর মান খুবই বাজে জুতার নিচে ফুটো করা ,জুতার নিচে ফুটো দিয়ে ভিতরে পানি ঢুকে। ",5,17 Sep 2025,108
dam onujaye motamuti valo. tobe amar mote na newa e valo. egula 1 doptah tikbr na. tai na newa tai best hobe. egula sudu dekhtei valo. quality valo na.  ,5,13 Mar 2025,153
"দাম অনুযায়ি ভালো ই কিন্তু বাম পায়ের জুতায়৷ একটু সমস্যা পাইচি। 
মনে হয় না বেশি দিন টিকবে । 
৪৫০ টাকা জুতা আর কেমন হবে৷ 
সব মিলিয়ে ১০/৭ ",5,27 Sep 2025,138
ভাই আপনাদের চোখে কি কোন সমস্যা আছে আপনাদেরকে অর্ডার করলাম একরকম আপনারা দিলেন আমাকে অন্যরকম   আপনারা কি কাস্টমারের চয়েজ পণ্য দেখে ডেলিভারি দেন না নিজের মন মত দেন কোনটা একটু জানাবেন প্লিজ  ,5,30 Jan 2025,188
যেমনটা চাইছিলাম তেমনটা পাই নাই। দাঁড়াযের  চোখে  সমস্যা আছে অর্ডার দিলাম একটা প্রোডাক্ট পাইলাম আর একটা।  ,5,12 Mar 2025,105
"আলহামদুলিল্লাহ, কম দামে এত ভালো সুজ পেয়ে যাবো বলার বাহিরে, সত্যি বলতে সুজ টা যেমন চেয়েছিলাম তেমন পেয়েছি,  আপনারা নিতে পারেন কম টাকায় ভালো কোয়ালিটির সুজ।  ",5,02 Jun 2025,154
এটা বেশি ভালো না ছবিতে যেমন দেখা যাচ্ছে বাই অন্য রকম দেখতে আবার খুব একটা খারাপ না টাকার পক্ষে ভালোই হয়েছে  ,5,6 days ago,107
ভাই সত্যি কথা বলতে অনেক সুন্দর জুতা আমি অনেক অল্প টাকায় পাইছি আপনারা চাইলে নিতে পারেন 💗❤️😈🔥🔥🔥🤑 ,5,14 Oct 2025,96
"Dam onujai thik ace😊🦋Quality er
khtha o damer upor nirbosil 438 tk ey er theke better pamu nah Jak bhaloi Ace product ta sobai nite paren......Colour dik diyeo Joss scl collage er thik ace Shoe ta.....Sob miliye 8/10 dimu ami ei shoe 👟 take
8/10 deoar karon Dam onujai......Shoe tar quality jemon e ace colours thik thake nah
.....Jak bhaloi Ace  ",5,16 Sep 2025,347
"অর্ডার করলাম কি আর পেলাম কি, এটা আশি করি নাই।দারাজের রেগুলার কাস্টমার হয়ে আমার সাথে এটা ঠিক হলো না😡😡😡😡 ",5,23 Mar 2025,103
"এই টাকা মোটামুটি জুতা কোয়ালিটি ঠিক আছে, তবে জুতাটা এত ময়লা মনে হচ্ছে যে পড়েছিল অথবা রাস্তা থেকে উঠিয়ে নিয়ে আসছে,, জুতা পরিষ্কারের জন্য আমার আলাদা করে আবার ১০০ টাকা খরচ করতে হয়েছে,, তবে অন্যদের নামে এটা বলতে পারি যে ভাই দারাজ থেকে জুতার নেওয়ার থেকে আপনি কোথা থেকে স্যান্ডেল কিনে নেন এই টাকা দিয়ে,, কারণ এরা জুতা দেয় ঠিকই যে তার কোয়ালিটিও থাকে ঠিকই কিন্তু জিতা ময়লা এত পরিমাণ ময়লা থাকে মনে হয় যে এই জুতার নেওয়া উপযুক্ত না,, ",5,22 Oct 2025,436
কি বলবো? প্রোডাক্টের কোয়ালিটি তেমন একটা ভালো না বলতে গেলে এক প্রকার বাজে একটা প্রোডাক্ট তাই আমি সবাইকে এটা না নিতে উচ্চত্ব করব। এখানে আমি অর্ডার দিয়েছিলাম দুইটা কোয়ান্টিটি টু ছিল কিন্তু আমি আর পাইছি একটা তারপরের দুইটা নিয়ে অনেক ঝামেলা হয়। ,5,07 Jan 2026,244
 যেমন চাইছি তেমন পায় নাই তাওসিরা আরো কালার ভালো না ছবিতে দেখা যাচ্ছে এমন বাস্তবে কালার ভালো না আপনারা কেউ অর্ডার দেবেন না একদম চিড়া পাগলামি জুতো আপনারা অর্ডার দিয়ে কেউ ভুল করবেন না  ,5,22 Mar 2025,185
Vai Products ta Moteo Vallo na Apnara keu nien na..  Ami ordar Dici Sada Jiuta Amake dise Ai Colour 😭😭 ,5,20 Sep 2025,103
"প্রোডাক্ট ভালো হয় নাই,দেখাইছেন একটা দিছে আরেকটা,আবার কি কেউ মনে হয় এই জুতো ইউজ করছে,ভিতরে তরকারির মত দাগ   লেগে রয়ছে হলুদ কালারে,বড় কথা হল জুতোগুলো আমি যেরকম দেখছি ওই রকম না। ",5,24 Mar 2025,179
ফালতু জুতা। কথায় আর কাজে মিল নাই। ময়লা দাগ মনে হয় কোথায় থেকে উনারা দিয়েছে এটা। তার ওপরে যে কালা চয়েস করছে ওই কালার দেয়নি ওরা।  ,5,10 Nov 2025,133
দারাজ মানে ভুয়া  কেউ দারাজ কে বিশ্বাস করবেন না তাহলে সহজে পোদ মারা খাবেন  আমি অডার দিছি একটা আর আমাকে দিছে আরেক টা তাও পায় ডুকে না🙂 ,5,18 Nov 2025,133
"চেয়েছি এটা দিছে এটা একদম ভালো না......বাজে দারাজ এরকম করবে আমি বুজলে নিতাম না 😡😡😡😡😡😡
আপনারা চাইলে নিতে পারেন.... ধন্যবাদ.... ",5,06 Oct 2025,125
জুতাটা খুবই ভালো হয়েছে ওটা তার প্যাকেজ যেন খুব ভালো ছিল দারাজ কে ধন্যবাদ আমি ভাবছিলাম হয়তো খারাপ হবে কিন্তু অনেক ভালো হয়েছেthanks ,5,13 Jan 2025,133
asole kijeee bolbo deekhai ek tokom dey onno rokom stock ee n thakle diben nh but jeta icche hoy oi tai diye dey dekhen nh naki vai apnar kana Hoye achen mone hoy hai hok Ami mutamuti valoiii paici  ,5,22 Mar 2025,199
aktu quality low hoileo dekte sundor ar jmn tah oder dici oita paici but halka aktu damage ar aktu fresh dile better hoto but price hisabe onk vlo ,5,18 Mar 2025,147
"যেটা ওডার দিয়েছিলাম ওটা পাইনি বাট তার চেও ভালোটা পেয়েছি 
 আমার এটাই ভালো লাগছে অনেক ❤️❤️❤️❤️❤️❤️❤️❤️❤️❤️❤️❤️❤️❤️❤️❤️❤️❤️❤️❤️❤️❤️❤️❤️❤️❤️❤️❤️❤️❤️❤️❤️❤️❤️❤️❤️❤️❤️❤️❤️❤️❤️❤️❤️❤️❤️❤️❤️❤️❤️❤️❤️❤️❤️ ",5,14 Nov 2025,193
"color change,  Size Change  kono mill nai.
order krci 42, size dise 43
Akhon aita diye ki krbo ami...?
products na thakle,  na kre de product nai. onno product dibe ke ",5,15 Nov 2025,168
"অনেক ভালো ই পাইছি। মোটামুটি কম টাকায় ভালোই 
চাইলে আপনারা নিতে পারেন 👍🏻👍🏻👍🏻👍🏻👍🏻👍🏻👍🏻👍🏻👍🏻👍🏻❤️❤️❤️❤️❤️❤️❤️❤️❤️❤️👍🏻👍🏻👍🏻 ",5,30 Oct 2025,116
"Alhamdulillah jemon ta oder korci, temon tai paici,,Alhamdulillah prices jemon,,product temon, Alhamdulillah, thank you salesman 🥰🥰🥰 ",5,15 Aug 2025,133
jamon juta oder korce tamin Paine Purai photos Ami barer kaj sob ai sob ki noksha kora naki amader satha draz company 😡😡😡 maderchod seller  ,5,27 Sep 2025,140
jemon ta dekhlam temon ta dey nai onno ta dise ar ata aktu puraton mone hocche kew use korse jaygay jaygay dag ase  ,5,08 Mar 2025,116
"আমার অর্ডার সম্পূর্ণভাবে সলিকভাবে এসেছে তারা ঠিকমতো ডেলিভারি করেছে যেটা দিয়েছিলাম ওইটাই পেয়েছি আমি একদিন পর আমার ডেলিভারি হয়েছে, 🥳🥳🥳🥳💵 ",5,25 Mar 2025,138
প্রাইজ অনুযায়ি প্রোডাক্ট ভালো ছিল কিন্তু ৫-৬ বছর গোডাউনে পরে থাকলে যেরকম ময়লা হয়ে যায় উপরে লালচে ভাব আসে তেমন ডেমেজ প্রোডাক্ট দিছে ৩০০ টাকার জুতা কিনে ১০০ টাকা দিয়ে ওয়াস করা লাগছে 🤬দেওয়ার সময় চেক করে দেয় না প্রোডাক্ট খুবই বাজে  ,5,25 May 2025,228
"এত কম দামে এত সুন্দর প্রোডাক্ট আসলে অনেক সুন্দর 
ডেলিভারি ম্যান টা অনেক ভালো ছিল এবং তার ব্যবহারটা অনেক ভালো ছিল আপনারা নিতে পারেন অনেক ভালো ",5,28 Jan 2025,141
ভাই আমি কি কালার অর্ডার দিলাম আর আপনি কি কালার দিলেন.? আমি দিলাম হোয়াইট কালার .. আর আপনি দিলেন কি কালার.? 😡 ,5,22 Sep 2025,109
Onek kharap kew niben na 41 oder korchi 42 diche tau valo na onek baje 50 taka dam hoile hoito 3 4 din pora jabe  ,5,18 Sep 2025,114
Ei Jutar Colour thik nay. kintu tao colour ta valo lagse ar ei jonno ami eta amar kase rakhbo. Kom price hisebe shobai nite paren(Recommend). ,4,19 Oct 2025,142
"আলহামদুলিল্লাহ জেমন টা ভাবছি ঠিক তেমনি,,, অনেক  ভালো,,প্রোডাক্টা আপনারা চাইলে নিতে পারেন,, আর ডেলিভারি ম্যানের ব্যাবহার ও অনেক ভালো,,,🥰 ",5,06 Mar 2025,136
দাম অনুযায়ী একদমই টিক নাই। এই রকম যুতা আমাদের সিলেট বন্দর ১০০ তেকে১৫০ টাকায় মিলে। পুরু প্লাস্টিক প্লাস্টিক লাগে। ,5,19 Dec 2025,113
"এই শব  একদম বাজে চেয়েছি একটা পেয়েছি আরেকটি ফালতু একটা প্রডাক্ট 

ওরা মানুষের মন নিয়ে খেলা করে 
 ",5,02 Jun 2025,99
"যেরকমটা দেখাই ছিল সেই রকমটা পাইনি,😐 অন্যরকম দিচ্ছে 😔 কিন্তু কিন্তু প্রডাকতা দাম হিশাবে ভালো🤗 ",5,05 Oct 2025,93
কি দিলেন ভাই সবাইকে দিলেন কি আর আমাকে দিলেন কি।  বুঝলাম না তো এটা তো একেবারে নরমাল কোয়ালিটি 🥹 ,5,26 Sep 2025,95
দাম অনুযায়ী অনেক ভালো। তবে কোয়ালিটি নিয়ে কিছু বলতে পারবো না। ব্যবহার করার পর বোঝা যাবে কেমন  ,5,06 Sep 2025,96
"প্রডাক্ট অনেক পছন্দ হয়েছে আমার খুব ভালো লাগছে 🥰
ধন্যবাদ দারাজ এত সুন্দর প্রডাক্ট দেওয়ার জন্য  ",5,23 May 2025,94
আসলে যেটা অর্ডার করছে ওইটা আসে নাই তবে পণ্যগুলো খুব ভালো দামের বিবেচনায় পণ্য অনেক ভালো 🙂😌 ,5,21 Dec 2024,91
khub valo elta product dam onusare valo but requler use er jonno na only 2.3 hours er jonno  ,5,24 Jan 2026,93
আলহামদুলিল্লাহ যেমন প্রডাক্ট আশা করছিলাম তেমন টা পেলাম।দাম অনুযায়ী প্রডাক্ট ভালোই খারাপ না।  ,5,25 Mar 2025,93
যেমন দেখছিলাম ঠিক তেমনি। কিন্তু একটু মোটা ও ভারী। কিন্তু প্রোডাক্টের দাম হিসেবে ঠিকই আছে। ,5,08 Aug 2025,90
দাম অনুযায়ী আলহামদুলিলা ভালো প্রোডাক্ট পেয়েসি। আসা করি পর্দাক্ট আরো ভালো হবে ইনশাআল্লাহ  ,5,15 Nov 2025,89
"অর্ডার করেছি কি এর দিছে ,,
জুতার কয়ালেটি একদম বাজে,, 
একদিন‌ও পড়া যাবে না খুলে যাবে ,, ",5,13 Oct 2025,89
"মাশাআল্লাহ অনেক ভালো হয়েছে,
ধন্যবাদ অনেক ভালো হয়েছে 💕💕👍👍👍💕💕💕👍👍👍💕💕👍💕💕💕 ",5,16 Aug 2025,72
আমি আজকেই হাতে পাইচি ৩ দিন পর দাম অনুজায়ি ভালোই বাট কয়েক দিন পায় দিলে বুজা জাবে কেমন👌👌 ,5,01 Feb 2025,87
Mota moti 🤐 valo  ,3,25 Dec 2024,18
"low quality and different product, very bad service . product not same my order product ",5,24 Sep 2025,88
প্রোডাক্ট অনেক অনেক ভালো যেমন চাইছি তেমন পাইছি ডেলিভারী ম্যানের ব্যবহার অনেক ভালো ❤️‍🩹 ,5,14 Mar 2025,87
কেউ নিবেন না কোয়ালিটি একদম বাজে এক কথায় দারাজ একদম ধোকাবাজ যেটা দেখায় অন্যটা দেয়  ,5,27 Jun 2025,86
খুব খারাপ প্রোডাক্ট। টাকা দিয়ে এটা নেওয়া যায় না। কালার যেটা দেওয়া ছিলো সেটা পাই নাই।  ,5,27 Oct 2025,86
সাদা কালার চাইছিলাম বাট এই কালার টা দিছে তাও খারাপ না জুতা টা ৩৮১ টাকায় ভালোই হইছে ,5,15 Nov 2025,83
কি ভাই চাইছি একটা দিছেন আর‌একটা সব কিছুই ঠিক ছিল কিন্তু যেটা চাইছি সেটা পাই নি 🫤 ,5,17 May 2025,81
দিয়েছিলাম সাদা জুতা দিয়েছে কালো জুতা  ডেলিভারি বয় এর ব্যবহারটা অনেক খারাপ ছিল  ,5,05 Oct 2025,82
বুজলাম না এইটা কি? দুইটা আলাদা আলাদা কেনো? এইজন্য online এ order দিতে ভয় লগে😡😡 ,5,28 May 2025,80
baal ar business koren miya chaisi akta disen akta gaanja khaiya business koren ,5,15 Mar 2025,80
অর্ডার করেছি এক মডেল হাতে পেয়েছে আরেক মডেল তাই পণ্যটি আবার রিটার্ন করে দিলাম।  ,5,14 Sep 2025,80
