review_text,rating,date,review_length
"দেখলাম সাদা হইলো কালো কিভাবে, 
অর্ডার দিলাম সাদা সু আইলো কালো সু এইটা কোনো কথা ",5,27 Sep 2025,79
জুতার দাম তিনশ তিন।ডেলিভারি চার্জসহ দাম হাকাইছে পাচশ উনিশ। কেমনে কি বুঝলাম না ,5,08 Sep 2025,78
"দেখাই ছেএক কালার দিছে আরেক কালার তাও আবার পুরাতন 
জুতার মানও ভালোনা 😡😡😡😡 ",5,14 Mar 2025,73
দুইটা এক সাথে অডার দিছিলাম আলহামদুলিল্লাহ যেমন দেখেছিলাম তেমনই পাইছি 🥰🥰🥰 ,5,16 Dec 2025,73
আলহামদুলিল্লাহ ভালো পেয়েছি এবং সেলার ভাইও ভালো ছিল৷ আপনারা সবাই নিতে পারেন  ,5,15 Jan 2026,76
কি অর্ডার করার দরকার নাই চাইছি কি আর দিছে কি যা অর্ডার করেছিলাম তা পাই নাই ,5,16 Nov 2025,75
"তুমি কাউকে রিকমেন্ড করব না 
কারণটা আপনারা দেখেন অনলাইন ভার্সেস রিয়েল 🫣

 ",5,11 May 2025,74
এই জুতাটা অনেক ভালো পেয়ে। অনেক comfortable. এই মালটা অনেক ভালো পেয়েছি।  ,5,07 Mar 2025,74
jemon dekaise temon paisi but ekta leka ulta ase..and kisu dag oh ase...  ,4,17 Jan 2025,74
বাটপার। যেটা অর্ডার দিয়েছিলাম সেটা না দিয়ে এই বুড়ো বেডার জুতা দিয়েছে। ,5,08 Jan 2025,74
"অর্ডার দিলাম কি আর ডেলিভারি পাইলাম কি😡😡😡😡
দারাজ এর এমনটা করা কি উচিত ",5,27 Sep 2025,69
"আলহামদুলিল্লাহ 
জুতাগুলো অনেক সুন্দর 
আপনারা নিশ্চিন্তে নিতে পারেন 💙💙 ",5,20 Dec 2024,70
"যাদের একান্তই পছন্দ হয় তারা নিতে পারেন মোটামুটি ভালই আছে  
এই জুতাটা  ",5,09 Mar 2025,71
আলহামদুলিল্লাহ এই বাজেট এর মধ্যে এটা অনেক ভালো আপনারা চাইলে নিতে পারেন ,5,22 Mar 2025,71
"মাশাল্লাহ, যেমন দেখছিলাম ঠিক তেমনি।
আর ডেলিভারি সময়ের আগেই পাইছি। 😊😊 ",5,14 Feb 2025,69
ভাই আমার জুতাই আমি সাইজ দিয়েছিলাম ৪২ দিছেন ৪১ তাও আবার অন্যটা 🤔🤔😡 ,5,14 Nov 2025,67
"আলহামদুলিল্লাহ প্রোডাক্ট অনেক ভালো,,, সবাই নিতে পারেন,,, 🥰🥰🥰🥰🥰🥰 ",5,01 Feb 2025,64
যেমন দেখেছি তেমন হয় নাই কিন্তু দাম অনুযায়ী জুতা অনেক ভালো পাইছি  ,5,02 Jul 2025,67
অর্ডার করলাম কি আর পাইলাম কি দাম হিসেবে ঠিক আছে কিন্তু পছন্দ হয়নি ,5,14 Sep 2025,67
0xc0674f14ef36dceb0a0e8482a2ba2856f9bb8720faaa7e0ef0cefbe339790a81 ,5,08 Mar 2025,67
"যে ররকম দেখছিলাম সেই পাই না, ডারাজ এর কাছ থেকে এইটা আশা করি নি 🙂 ",5,10 Mar 2025,65
জুতাটি আমার পায়ের ছোট হয় তারপর জুতাটি দেখছি এক রকম পাইছি আরেক রকম ,5,14 Dec 2024,66
অর্ডার করেছিলাম একটা দিয়েছে আরেকটা। পণ্যের কোয়ালিটি অনেক খারাপ। ,5,11 Oct 2025,66
এই প্রথম দারাজ থেকে ওড়ার দিলাম এই জুতাটা দাম আনু যাই অনেক ভালো  ,5,17 Aug 2025,65
akdom faltu product dakhailo ki deca ki . khankir polara faltu😒 ,5,15 Sep 2025,64
"Praise Hiseby Product Thik ase, Er thyky Besi asa kora Thik na😅 ",5,07 Sep 2025,64
যেমন দেখছি তেমন পাইছি অনেক সুন্দর পাইছি দাম হিসেবে অনেক সুন্দর  ,5,27 May 2025,64
যেমনটি চেয়েছি তেমনই পেয়েছি।আর ডেলিভারি মেন এর বেবহার অনেক ভালো। ,4,26 Feb 2025,64
দেখতে সুন্দর আছে দাম অনুযায়ী ঠিক আছে কিন্তু কোয়ালিটি ভালো না  ,5,14 Sep 2025,64
Faltuuu🤬🤬 Evabe thokanur mane ki?? product er kunu mil e nai ,5,17 Nov 2025,61
আলহামদুলিল্লাহ ভালো প্রোডাক্ট  পেয়েছি  আপনারা চাইলে নিতে পারেন ,5,06 Sep 2025,63
অর্ডার দিলাম একটা ডেলিভারি পাইলাম আরেকটা একদম উচিত হয়নি এটা। ,5,14 Nov 2025,62
ওয়াও সেই সুন্দর অনেক ভালো মানের প্রোডাক্ট জুতোটা হেবি সুন্দর ,5,09 Mar 2025,62
"very bad.. 5 minute paye na dite ei hal jutar...
khuboi baje  ",5,20 Oct 2025,62
ভাই দাম অনুযায়ী জুতা টা অনেক ভালো খুব তাড়াতাড়ি জুতাটা হাতে পেয়ে গেছি দারাজ কে অনেক ধন্যবাদ 🥰🥰🥰🥰🥰🥰🥰🥰🥰🥰🥰,5,27 Sep 2023,106
সবতো ঠিক আছে বাট অডার করছিলাম ৪১ দেছে ৪০ স্টিকার লাগেয়ে দিছে ,5,21 Jun 2025,61
Humm valo paiche . sobai nete paren . ai dam a valoi paiche  ,5,18 Sep 2025,61
Just looking for wow.......... কম দামে এর থেকে ভালো কিছু  হবেনা মনে হয়,5,12 Nov 2023,70
মুটামুটি  ভালোই কম দামে জুতাটা আপনারা চাইলে নিতে পারেন 🫠🫠 ,5,20 Jan 2025,58
দামের তুলনায় অনেক বেশি ভালো ডেলিভারি ম্যানকে ধন্যবাদ জানান  ,5,16 Aug 2025,60
খারাপ না দাম হিসেবে ভালোই আছে সেলার টা অনেক বেশি ভালো ছিল।  ,4,25 Nov 2024,60
মোটামুটি ভালো পন্য পেয়েছি আশা করি পরবর্তীতেও ভালো পন্য দিবে ,5,28 Aug 2025,60
"সাইজ ঠিক আছে কিন্তু ডিজাইন অন্য দিয়েছে,,,,পরতে বিরক্ত লাগছে ",5,13 Nov 2025,60
প্রোডাক্ট দেখায় এক রকম দিছে আরেক রখম পুরাই ফালতু সেলার এরা ,5,14 Nov 2025,59
The quality is very bad..I liked one but not the other..🙄 ,5,20 Sep 2025,58
Jeita odar dici seita paini..pic a jeita paici ata peyeci ,5,10 Feb 2025,58
"khub sundor Ekta product,onek Valo ei price e onek Valo  ",5,06 Oct 2025,57
চেয়েছিলাম সাদা আর ব্লাক এখানে বাদামী রঙের দেওয়া হয়েছে ,5,13 Sep 2025,57
"একদম  বাজে একটা জুতা দিয়ে দিছে
দেখাইছে একটা দিছে আরেকটা ",5,14 Nov 2025,56
পুরা ফালতু ভাই অর্ডার করছি একটা দিছে আরেকটা 😡😡🤬🤬🤬 ,5,16 Nov 2025,50
যেমন টা ছাইচি তেমন টা পাই নাই অডার দিচি কি আর দিলো কি  ,5,18 Mar 2025,55
"জুতার কোয়ালিটি টা একদম বাজে। কিন্তু দেখতে সুন্দর আছে 
 ",5,15 Nov 2025,55
"ধন্যবাদ দারাজ এতো তারাতাড়ি দেওয়ার জন্য  🙂
 আার আমি যা চেয়েছিলাম তাই দিয়েছে যদিও একটু সমস্যা আছে কিন্তু যে দাম তা হিসেবে প্রোডাক্ট অনেক ভালো 🙃",4,17 Sep 2023,141
আমার জুতা দেওয়ার কথা ছিল সাদা কালার দিছে অন্য কালার  ,5,14 Nov 2025,54
juta ta kharap na tobe dekhesilam white diyese arekta ,5,18 Nov 2025,54
"বাজে প্রোডাক্ট।।
অর্ডার দিছি একটা আসছে আরেকটা।।🥴😡🤬 ",5,21 Sep 2025,51
আলহামদুলিল্লাহ প্রাইজ হিসাবে প্রোডাক্ট টা অনেক ভালো  ,5,18 Dec 2024,53
"Nice product
 First delivery 
finally Alhamdulillah  ",5,12 Nov 2025,53
কম দাম হিসেবে জুতা মোটামুটি ভালো কিন্তু একটু নরমাল  ,5,15 Feb 2025,52
যেইটা অর্ডার দিছি সেইটা দেয় নাই। কি একটা ঠক দিলো।  ,5,13 Nov 2025,51
"তিন দিন এই অবস্থা 
একদম ফালতু..... কেউ কিনবেন না  ",5,25 Nov 2024,50
"আলহামদুলিল্লাহ ভালো যেমন দেখেছিলাম তেমনই পাইছি। 
 ",5,22 Dec 2025,50
জুতা গুলো ভালই এই ফ্রাইসে এরকম জুতা পাব ো ভাবিনি  ,4,17 Dec 2025,50
এই জুতা একে বারে বাজে আনের সাথে আঠা ছুটানো পাইছি  ,5,17 Sep 2025,50
মোটামোটি ভাল কিন্তু অন্য রকম পোডাক্ট অডার দিয়েলাম ,5,16 Nov 2025,50
"এইমাত্র  হাতে পেলাম,  টাকা হিসেবে পোডাক্টটি ভালো  ",5,23 Jun 2025,50
"দাম অনুযাই জুতাটি অনেক ভালো পড়েছে
দারাজকে দন্যবাদ ",5,03 Dec 2024,50
আলহামদুলিল্লাহ ভালো মাল। আমি খুবই ভালো পেয়েছি।  ,5,01 Mar 2025,49
"Order dichilam Shada colour,, Ashce Onno colour. ",5,15 Oct 2025,49
চাইছি একরকম পাইছি আরেকরকম জুতার কোয়ালিটি ভালো  ,5,24 Nov 2025,48
চাইছি একটা দিছে আরেকট্ তাও আবার ২ টাই ডান পায়ের ,5,08 Oct 2025,48
আলহামদুলিল্লাহ 💕 ভালো ভাবে পার্সেল টি পেয়েছি  ,5,16 Jul 2025,47
খুব ভালো। দামটা কম কিন্তু জিনিস ভালো ধন্যবাদ।  ,5,23 May 2025,47
"যেই প্রোডাক্টিভিটি চেয়েছি ওটাই পেয়েছি,ধন্যবাদ  ",5,18 Nov 2025,47
